{"dynamicProviders":["commandcode-goat","grok-build","omlx"],"profiles":[{"displayName":"Balanced","id":"alibaba-token-plan-balanced","providerGroup":"ALIBABA TOKEN PLAN","requiredProviders":["alibaba-token-plan"],"roleBindings":{"architect":"alibaba-token-plan/qwen3.8-max-preview:xhigh","critic":"alibaba-token-plan/glm-5.2:high","default":"alibaba-token-plan/qwen3.8-max-preview:medium","executor":"alibaba-token-plan/deepseek-v4-pro:xhigh","planner":"alibaba-token-plan/glm-5.2:high"}},{"displayName":"GLM + DeepSeek","id":"alibaba-token-plan-glm-deepseek","providerGroup":"ALIBABA TOKEN PLAN","requiredProviders":["alibaba-token-plan"],"roleBindings":{"architect":"alibaba-token-plan/glm-5.2:xhigh","critic":"alibaba-token-plan/glm-5.2:xhigh","default":"alibaba-token-plan/glm-5.2:high","executor":"alibaba-token-plan/deepseek-v4-flash-0731:high","planner":"alibaba-token-plan/deepseek-v4-flash-0731:max"}},{"displayName":"Pro","id":"alibaba-token-plan-pro","providerGroup":"ALIBABA TOKEN PLAN","requiredProviders":["alibaba-token-plan"],"roleBindings":{"architect":"alibaba-token-plan/qwen3.8-max-preview:xhigh","critic":"alibaba-token-plan/glm-5.2:xhigh","default":"alibaba-token-plan/qwen3.8-max-preview:medium","executor":"alibaba-token-plan/deepseek-v4-flash-0731:max","planner":"alibaba-token-plan/glm-5.2:high"}},{"displayName":"Qwen + DeepSeek","id":"alibaba-token-plan-qwen-deepseek","providerGroup":"ALIBABA TOKEN PLAN","requiredProviders":["alibaba-token-plan"],"roleBindings":{"architect":"alibaba-token-plan/qwen3.8-max:xhigh","critic":"alibaba-token-plan/qwen3.8-max:xhigh","default":"alibaba-token-plan/qwen3.8-max:high","executor":"alibaba-token-plan/deepseek-v4-flash-0731:high","planner":"alibaba-token-plan/deepseek-v4-flash-0731:max"}},{"displayName":"QwenMaxxing","id":"alibaba-token-plan-qwenmaxxing","providerGroup":"ALIBABA TOKEN PLAN","requiredProviders":["alibaba-token-plan"],"roleBindings":{"architect":"alibaba-token-plan/qwen3.8-max-preview:xhigh","critic":"alibaba-token-plan/qwen3.8-max-preview:xhigh","default":"alibaba-token-plan/qwen3.8-max-preview:medium","executor":"alibaba-token-plan/qwen3.8-max-preview:low","planner":"alibaba-token-plan/qwen3.8-max-preview:medium"}},{"displayName":"ASTRA-Default","id":"astra-default","providerGroup":"CODEX","requiredProviders":["openai-codex"],"roleBindings":{"architect":"openai-codex/gpt-5.6-terra:xhigh","critic":"openai-codex/gpt-5.6-sol:xhigh","default":"openai-codex/gpt-6-astra:medium","executor":"openai-codex/gpt-5.6-luna:max","planner":"openai-codex/gpt-6-astra:xhigh"}},{"displayName":"ASTRA + Fable (5.1)","id":"astra-fable","providerGroup":"COMBOS","requiredProviders":["openai-codex","anthropic"],"roleBindings":{"architect":"anthropic/claude-fable-5-1:xhigh","critic":"anthropic/claude-fable-5-1:xhigh","default":"openai-codex/gpt-6-astra:medium","executor":"openai-codex/gpt-5.6-luna:max","planner":"openai-codex/gpt-6-astra:xhigh"}},{"displayName":"ASTRA + Fable (5.1) + Opus","id":"astra-fable-opus","providerGroup":"COMBOS","requiredProviders":["openai-codex","anthropic"],"roleBindings":{"architect":"anthropic/claude-fable-5-1:xhigh","critic":"anthropic/claude-fable-5-1:xhigh","default":"openai-codex/gpt-6-astra:medium","executor":"openai-codex/gpt-5.6-luna:max","planner":"anthropic/claude-opus-5:medium"}},{"displayName":"ASTRA-Heavy","id":"astra-heavy","providerGroup":"CODEX","requiredProviders":["openai-codex"],"roleBindings":{"architect":"openai-codex/gpt-6-astra:max","critic":"openai-codex/gpt-6-astra:max","default":"openai-codex/gpt-6-astra:medium","executor":"openai-codex/gpt-5.6-sol:max","planner":"openai-codex/gpt-5.6-sol:max"}},{"displayName":"ASTRA-Lite","id":"astra-lite","providerGroup":"CODEX","requiredProviders":["openai-codex"],"roleBindings":{"architect":"openai-codex/gpt-5.6-terra:xhigh","critic":"openai-codex/gpt-5.6-sol:high","default":"openai-codex/gpt-6-astra:medium","executor":"openai-codex/gpt-5.6-luna:xhigh","planner":"openai-codex/gpt-6-astra:xhigh"}},{"displayName":"Claude Fable","id":"claude-fable","providerGroup":"CLAUDE","requiredProviders":["anthropic"],"roleBindings":{"architect":"anthropic/claude-fable-5-1:xhigh","critic":"anthropic/claude-fable-5-1:high","default":"anthropic/claude-fable-5-1:xhigh","executor":"anthropic/claude-sonnet-5","planner":"anthropic/claude-fable-5-1:low"}},{"displayName":"Claude Opus","id":"claude-opus","providerGroup":"CLAUDE","requiredProviders":["anthropic"],"roleBindings":{"architect":["anthropic/claude-opus-5:xhigh","anthropic/claude-opus-4-6:xhigh"],"critic":["anthropic/claude-opus-5:high","anthropic/claude-opus-4-6:high"],"default":["anthropic/claude-opus-5:xhigh","anthropic/claude-opus-4-6:xhigh"],"executor":"anthropic/claude-sonnet-5","planner":["anthropic/claude-opus-5:low","anthropic/claude-opus-4-6:low"]}},{"displayName":"Codex Eco","id":"codex-eco","providerGroup":"CODEX","requiredProviders":["openai-codex"],"roleBindings":{"architect":"openai-codex/gpt-5.6-terra:high","critic":"openai-codex/gpt-5.6-terra:xhigh","default":"openai-codex/gpt-5.6-terra:low","executor":"openai-codex/gpt-5.6-luna:low","planner":"openai-codex/gpt-5.6-luna:high"}},{"displayName":"Codex Medium","id":"codex-medium","providerGroup":"CODEX","requiredProviders":["openai-codex"],"roleBindings":{"architect":"openai-codex/gpt-5.6-sol:high","critic":"openai-codex/gpt-5.6-sol:xhigh","default":"openai-codex/gpt-5.6-sol:low","executor":"openai-codex/gpt-5.6-terra:low","planner":"openai-codex/gpt-5.6-terra:high"}},{"displayName":"Codex + OpenCodeGo","id":"codex-opencodego","providerGroup":"COMBOS","requiredProviders":["openai-codex","opencode-go"],"roleBindings":{"architect":"openai-codex/gpt-5.6-sol:high","critic":"opencode-go/mimo-v2.5-pro","default":"openai-codex/gpt-5.6-sol:low","executor":"opencode-go/deepseek-v4-pro","planner":"opencode-go/kimi-k3"}},{"displayName":"Codex Pro","id":"codex-pro","providerGroup":"CODEX","requiredProviders":["openai-codex"],"roleBindings":{"architect":"openai-codex/gpt-5.6-sol:xhigh","critic":"openai-codex/gpt-5.6-sol:max","default":"openai-codex/gpt-5.6-sol:medium","executor":"openai-codex/gpt-5.6-terra:medium","planner":"openai-codex/gpt-5.6-sol:high"}},{"displayName":"Command Code GOAT","id":"commandcode-goat","providerGroup":"COMMAND CODE GOAT","requiredProviders":["commandcode-goat"],"roleBindings":{"architect":"commandcode-goat/deepseek/deepseek-v4-pro","critic":"commandcode-goat/zai-org/GLM-5.2","default":"commandcode-goat/zai-org/GLM-5.3","executor":"commandcode-goat/deepseek/deepseek-v4-flash","planner":"commandcode-goat/moonshotai/Kimi-K3"}},{"displayName":"Cursor Eco","id":"cursor-eco","providerGroup":"CURSOR","requiredProviders":["cursor"],"roleBindings":{"architect":"cursor/composer-2.5","critic":"cursor/composer-2.5","default":"cursor/composer-2.5","executor":"cursor/composer-2.5","planner":"cursor/composer-2.5"}},{"displayName":"Cursor Medium","id":"cursor-medium","providerGroup":"CURSOR","requiredProviders":["cursor"],"roleBindings":{"architect":"cursor/composer-2.5-fast","critic":"cursor/composer-2.5-fast","default":"cursor/composer-2.5","executor":"cursor/composer-2.5-fast","planner":"cursor/composer-2.5"}},{"displayName":"Cursor Pro","id":"cursor-pro","providerGroup":"CURSOR","requiredProviders":["cursor"],"roleBindings":{"architect":"cursor/composer-2.5-fast","critic":"cursor/composer-2.5-fast","default":"cursor/composer-2.5-fast","executor":"cursor/composer-2.5-fast","planner":"cursor/composer-2.5-fast"}},{"displayName":"Fable + Opus + Codex","id":"fable-opus-codex","providerGroup":"COMBOS","requiredProviders":["anthropic","openai-codex"],"roleBindings":{"architect":"openai-codex/gpt-5.6-sol:xhigh","critic":"anthropic/claude-opus-5:high","default":"anthropic/claude-fable-5-1:high","executor":"openai-codex/gpt-5.6-terra:medium","planner":"anthropic/claude-opus-5:medium"}},{"displayName":"GLM Eco","id":"glm-eco","providerGroup":"GLM","requiredProviders":["zai"],"roleBindings":{"architect":"zai/glm-5.3:high","critic":"zai/glm-5.3:high","default":"zai/glm-5.3-flash:low","executor":"zai/glm-5.3-flash:low","planner":"zai/glm-5.3-flash:low"}},{"displayName":"GLM Medium","id":"glm-medium","providerGroup":"GLM","requiredProviders":["zai"],"roleBindings":{"architect":"zai/glm-5.3:max","critic":"zai/glm-5.3:high","default":"zai/glm-5.3:high","executor":"zai/glm-5.3-flash:low","planner":"zai/glm-5.3:high"}},{"displayName":"GLM Pro","id":"glm-pro","providerGroup":"GLM","requiredProviders":["zai"],"roleBindings":{"architect":"zai/glm-5.3:max","critic":"zai/glm-5.3:max","default":"zai/glm-5.3:max","executor":"zai/glm-5.3-flash:high","planner":"zai/glm-5.3:high"}},{"displayName":"Grok 4.5 Eco","id":"grok-45-eco","providerGroup":"GROK","requiredProviders":["xai"],"roleBindings":{"architect":"xai/grok-4.5:high","critic":"xai/grok-4.5:medium","default":"xai/grok-4.5:low","executor":"xai/grok-4.5:low","planner":"xai/grok-4.5:low"}},{"displayName":"Grok 4.5 Medium","id":"grok-45-medium","providerGroup":"GROK","requiredProviders":["xai"],"roleBindings":{"architect":"xai/grok-4.5:high","critic":"xai/grok-4.5:high","default":"xai/grok-4.5:medium","executor":"xai/grok-4.5:low","planner":"xai/grok-4.5:medium"}},{"displayName":"Grok 4.5 Pro","id":"grok-45-pro","providerGroup":"GROK","requiredProviders":["xai"],"roleBindings":{"architect":"xai/grok-4.5:high","critic":"xai/grok-4.5:high","default":"xai/grok-4.5:high","executor":"xai/grok-4.5:medium","planner":"xai/grok-4.5:high"}},{"displayName":"Grok 4.6 Eco","id":"grok-46-eco","providerGroup":"GROK","requiredProviders":["xai"],"roleBindings":{"architect":"xai/grok-4.6:high","critic":"xai/grok-4.6:medium","default":"xai/grok-4.6:low","executor":"xai/grok-4.6:low","planner":"xai/grok-4.6:low"}},{"displayName":"Grok 4.6 Medium","id":"grok-46-medium","providerGroup":"GROK","requiredProviders":["xai"],"roleBindings":{"architect":"xai/grok-4.6:high","critic":"xai/grok-4.6:high","default":"xai/grok-4.6:medium","executor":"xai/grok-4.6:low","planner":"xai/gro